{
  "metadata": {
    "system_name": null,
    "date": null,
    "ref": null,
    "evaluator_organization": null,
    "phase_1_attendees": [],
    "phase_2_attendees": []
  },
  "system_scope": {
    "summary": "An Event framework in which application logic and the framework itself are highly inter-dependent; core components include a Main module (part of the framework), an Event Manager that interacts directly with application handlers, an Event Queue, and a base Handler component extended by standard and application-specific handlers.",
    "basis": "observed",
    "source_refs": ["evaluation_inputs.system_description"]
  },
  "business_drivers": [
    {"id": "BD-1", "kind": "business_goal", "statement": "Provide an Event framework to be used by an application", "basis": "observed", "source_refs": ["evaluation_inputs.business_context.business_goals[0]"]},
    {"id": "BD-2", "kind": "business_goal", "statement": "Handle and process events through component interaction", "basis": "observed", "source_refs": ["evaluation_inputs.business_context.business_goals[1]"]},
    {"id": "BD-3", "kind": "business_goal", "statement": "Allow application components to utilize the framework services", "basis": "observed", "source_refs": ["evaluation_inputs.business_context.business_goals[2]"]},
    {"id": "BD-4", "kind": "technical_constraint", "statement": "Must handle system termination via STOP handler", "basis": "observed", "source_refs": ["evaluation_inputs.business_context.technical_constraints[0]"]},
    {"id": "BD-5", "kind": "technical_constraint", "statement": "Must maintain system in idle state until input is received", "basis": "observed", "source_refs": ["evaluation_inputs.business_context.technical_constraints[1]"]},
    {"id": "BD-6", "kind": "architectural_driver", "statement": "Variability", "basis": "observed", "source_refs": ["evaluation_inputs.business_context.architectural_drivers[0]"]},
    {"id": "BD-7", "kind": "architectural_driver", "statement": "Reliability", "basis": "observed", "source_refs": ["evaluation_inputs.business_context.architectural_drivers[1]"]},
    {"id": "BD-8", "kind": "architectural_driver", "statement": "Conceptual Integrity", "basis": "observed", "source_refs": ["evaluation_inputs.business_context.architectural_drivers[2]"]},
    {"id": "BD-9", "kind": "architectural_driver", "statement": "Functionality", "basis": "observed", "source_refs": ["evaluation_inputs.business_context.architectural_drivers[3]"]},
    {"id": "BD-10", "kind": "architectural_driver", "statement": "Modifiability", "basis": "observed", "source_refs": ["evaluation_inputs.business_context.architectural_drivers[4]"]},
    {"id": "BD-11", "kind": "runtime_constraint", "statement": "Events must be dispatched in a First-Come-First-Served (FIFO) pattern", "basis": "observed", "source_refs": ["evaluation_inputs.phase_2_architectural_context.runtime_constraints[0]"]},
    {"id": "BD-12", "kind": "runtime_constraint", "statement": "System must maintain an 'idle wait' state until input is received", "basis": "observed", "source_refs": ["evaluation_inputs.phase_2_architectural_context.runtime_constraints[1]"]},
    {"id": "BD-13", "kind": "runtime_constraint", "statement": "Application logic is embedded within framework components", "basis": "observed", "source_refs": ["evaluation_inputs.phase_2_architectural_context.runtime_constraints[2]"]}
  ],
  "architecture_evidence": [
    {"id": "AE-1", "evidence_kind": "system_description", "statement": "The application logic and framework are highly inter-dependent", "basis": "observed", "source_refs": ["evaluation_inputs.system_description"]},
    {"id": "AE-2", "evidence_kind": "system_description", "statement": "The Main module is part of the framework", "basis": "observed", "source_refs": ["evaluation_inputs.system_description"]},
    {"id": "AE-3", "evidence_kind": "system_description", "statement": "The Event Manager interacts directly with application handlers", "basis": "observed", "source_refs": ["evaluation_inputs.system_description"]},
    {"id": "AE-4", "evidence_kind": "system_description", "statement": "The system features an Event Queue", "basis": "observed", "source_refs": ["evaluation_inputs.system_description"]},
    {"id": "AE-5", "evidence_kind": "system_description", "statement": "The system has a base Handler component extended by standard and application-specific handlers", "basis": "observed", "source_refs": ["evaluation_inputs.system_description"]},
    {"id": "AE-6", "evidence_kind": "deployment_topology", "statement": "System accepts input via Command Line Interface (CLI)", "basis": "observed", "source_refs": ["evaluation_inputs.phase_2_architectural_context.hardware_view_description[0]"]},
    {"id": "AE-7", "evidence_kind": "deployment_topology", "statement": "Single processor execution implied (sequential event processing)", "basis": "observed", "source_refs": ["evaluation_inputs.phase_2_architectural_context.hardware_view_description[1]"]},
    {"id": "AE-8", "evidence_kind": "quantitative_parameter", "statement": "performance_proxy: Number of components involved in a transaction", "basis": "observed", "source_refs": ["evaluation_inputs.quantitative_model_parameters.performance_proxy"]},
    {"id": "AE-9", "evidence_kind": "quantitative_parameter", "statement": "transaction_speed: Qualitative (Slow due to high number of components involved)", "basis": "observed", "source_refs": ["evaluation_inputs.quantitative_model_parameters.transaction_speed"]},
    {"id": "AE-10", "evidence_kind": "quantitative_parameter", "statement": "architecture_limits: 1 event manager, 1 event queue", "basis": "observed", "source_refs": ["evaluation_inputs.quantitative_model_parameters.architecture_limits.event_managers", "evaluation_inputs.quantitative_model_parameters.architecture_limits.event_queues"]},
    {"id": "AE-11", "evidence_kind": "style_probe", "statement": "Evaluators probe the Event-Driven Architecture style.", "basis": "observed", "source_refs": ["evaluation_inputs.investigative_prompts.style_probes.target_style"]},
    {"id": "AE-12", "evidence_kind": "documentation_status", "statement": "Fully developed architecture with class diagrams, component descriptions, and defined component interactions.", "basis": "observed", "source_refs": ["evaluation_inputs.phase_1_discovery.initial_documentation_status"]}
  ],
  "open_questions": [
    {"id": "Q-1", "question": "Does the system allow unauthorized access?", "origin": "investigative_prompt", "source_refs": ["evaluation_inputs.investigative_prompts.style_probes.questions[0]"]},
    {"id": "Q-2", "question": "Does the architecture portray data confidentiality?", "origin": "investigative_prompt", "source_refs": ["evaluation_inputs.investigative_prompts.style_probes.questions[1]"]},
    {"id": "Q-3", "question": "Does the architecture process any task in the fastest possible speed?", "origin": "investigative_prompt", "source_refs": ["evaluation_inputs.investigative_prompts.style_probes.questions[2]"]},
    {"id": "Q-4", "question": "Can the components of the architecture be reused for future projects?", "origin": "input_inquiry_question", "source_refs": ["evaluation_inputs.phase_1_discovery.evaluator_inquiry_questions[0]"]},
    {"id": "Q-5", "question": "Can the framework be expanded in the future to accommodate a new application or new components?", "origin": "input_inquiry_question", "source_refs": ["evaluation_inputs.phase_1_discovery.evaluator_inquiry_questions[1]"]},
    {"id": "Q-6", "question": "Will the system handle any input given by the user and handle invalid input?", "origin": "input_inquiry_question", "source_refs": ["evaluation_inputs.phase_1_discovery.evaluator_inquiry_questions[2]"]},
    {"id": "Q-7", "question": "Is the architecture consistent in behavior?", "origin": "input_inquiry_question", "source_refs": ["evaluation_inputs.phase_1_discovery.evaluator_inquiry_questions[3]"]},
    {"id": "Q-8", "question": "Can any new application-specific functionality be added to the architecture?", "origin": "input_inquiry_question", "source_refs": ["evaluation_inputs.phase_1_discovery.evaluator_inquiry_questions[4]"]},
    {"id": "Q-9", "question": "Can the system be modified in short time and cost-effective manner?", "origin": "input_inquiry_question", "source_refs": ["evaluation_inputs.phase_1_discovery.evaluator_inquiry_questions[5]"]},
    {"id": "Q-10", "question": "Do the components interact properly?", "origin": "input_inquiry_question", "source_refs": ["evaluation_inputs.phase_1_discovery.evaluator_inquiry_questions[6]"]},
    {"id": "Q-11", "question": "Does the architecture perform its event-processing task properly?", "origin": "input_inquiry_question", "source_refs": ["evaluation_inputs.phase_1_discovery.evaluator_inquiry_questions[7]"]},
    {"id": "Q-12", "question": "What is the system name, evaluation date, reference id, evaluating organization, and attendee lists for phase 1 and phase 2?", "origin": "evaluator_gap", "source_refs": []},
    {"id": "Q-13", "question": "What measurable thresholds (units, target values, time limits) apply to the raw candidate scenarios, particularly RS-2 ('fastest possible speed') and RS-3 ('immediate recovery')?", "origin": "evaluator_gap", "source_refs": ["evaluation_inputs.raw_candidate_scenarios"]},
    {"id": "Q-14", "question": "Can the fully developed architecture documentation (class diagrams, component descriptions, interaction specifications) referenced in phase_1_discovery.initial_documentation_status be supplied as an artifact for this evaluation?", "origin": "evaluator_gap", "source_refs": ["evaluation_inputs.phase_1_discovery.initial_documentation_status"]}
  ],
  "context_status": {
    "value": "sufficient",
    "evidence": [
      "evaluation_inputs.system_description names concrete components (Main, Event Manager, Event Queue, Handler) and states a relation between them",